{
  "$schema": "https://json-schema.org/draft/2020-12/schema",
  "$id": "https://github.com/OssaBellator/DefeatWatermarker/schemas/reliability-corpus-v0.1.schema.json",
  "title": "DefeatWatermarker detector reliability corpus v0.1",
  "type": "object",
  "additionalProperties": false,
  "required": ["schema_version", "corpus_id", "version", "adapter_id", "description", "cases"],
  "properties": {
    "schema_version": {"const": "0.1"},
    "corpus_id": {"type": "string", "pattern": "^[A-Za-z0-9][A-Za-z0-9_.-]{0,127}$"},
    "version": {"type": "string", "minLength": 1, "maxLength": 64},
    "adapter_id": {"type": "string", "pattern": "^[A-Za-z0-9][A-Za-z0-9_.-]{0,127}$"},
    "description": {"type": "string", "maxLength": 4000},
    "cases": {
      "type": "array",
      "minItems": 1,
      "maxItems": 1000,
      "items": {
        "type": "object",
        "additionalProperties": false,
        "required": ["case_id", "path", "media_type", "modality", "expected_detected"],
        "properties": {
          "case_id": {"type": "string", "pattern": "^[A-Za-z0-9][A-Za-z0-9_.-]{0,127}$"},
          "path": {"type": "string", "minLength": 1, "maxLength": 4096},
          "media_type": {"type": "string", "minLength": 1, "maxLength": 255},
          "modality": {"enum": ["image", "video", "audio", "text", "document", "binary", "unknown"]},
          "expected_detected": {"type": "boolean"}
        }
      }
    }
  }
}
