{
  "schema_version": "0.1",
  "corpus_id": "fixture-text-detector-reliability",
  "version": "0.1",
  "adapter_id": "fixture.text-marker.v1",
  "description": "Synthetic two-case labelled corpus proving explicit provider detector reliability execution and runtime-bound reporting.",
  "cases": [
    {
      "case_id": "positive-primary",
      "path": "positive-primary.txt",
      "media_type": "text/plain",
      "modality": "text",
      "expected_detected": true
    },
    {
      "case_id": "negative",
      "path": "negative.txt",
      "media_type": "text/plain",
      "modality": "text",
      "expected_detected": false
    }
  ]
}
